{
  "$schema": "http://json-schema.org/draft-07/schema#",
  "$id": "https://hatago.dev/schemas/plugin.json",
  "title": "Hatago Plugin Manifest",
  "description": "Schema for hatago.plugin.json files",
  "type": "object",
  "required": ["name", "version", "description", "engines", "capabilities", "entry"],
  "properties": {
    "name": {
      "type": "string",
      "pattern": "^(@[a-z0-9-~][a-z0-9-._~]*/)?[a-z0-9-~][a-z0-9-._~]*$",
      "description": "Plugin package name (follows npm naming conventions)"
    },
    "version": {
      "type": "string",
      "pattern": "^\\d+\\.\\d+\\.\\d+(-[a-zA-Z0-9-]+)?$",
      "description": "Semantic version"
    },
    "description": {
      "type": "string",
      "minLength": 1,
      "maxLength": 200,
      "description": "Human-readable description"
    },
    "engines": {
      "type": "object",
      "required": ["hatago"],
      "properties": {
        "hatago": {
          "type": "string",
          "description": "Compatible Hatago core version (semver range)"
        },
        "node": {
          "type": "string",
          "description": "Node.js version requirement (optional)"
        },
        "workers": {
          "type": "string",
          "description": "Cloudflare Workers compatibility date (optional)"
        }
      },
      "additionalProperties": false
    },
    "capabilities": {
      "type": "array",
      "items": {
        "type": "string",
        "enum": ["fetch", "kv", "logger", "timer", "crypto"]
      },
      "uniqueItems": true,
      "description": "Required capabilities"
    },
    "entry": {
      "type": "object",
      "required": ["default"],
      "properties": {
        "node": {
          "type": "string",
          "description": "Node.js entry point"
        },
        "workers": {
          "type": "string",
          "description": "Cloudflare Workers entry point"
        },
        "default": {
          "type": "string",
          "description": "Default entry point"
        }
      },
      "additionalProperties": false
    },
    "mcp": {
      "type": "object",
      "properties": {
        "tools": {
          "type": "array",
          "items": {
            "type": "object",
            "required": ["name", "title", "description"],
            "properties": {
              "name": {
                "type": "string",
                "pattern": "^[a-z0-9._-]+$"
              },
              "title": {
                "type": "string",
                "minLength": 1
              },
              "description": {
                "type": "string",
                "minLength": 1
              }
            },
            "additionalProperties": false
          }
        }
      },
      "additionalProperties": false,
      "description": "MCP tool declarations (optional)"
    }
  },
  "additionalProperties": false
}
